"Tiêu chí","Điểm","Mô tả","Điểm Nhóm 10"
"Hiểu đúng vấn đề bảo mật","2","Giải thích đúng khái niệm,nguyên nhân và điều kiện xảy ra lỗ hổng","1.5"
"Demo rõ ràng, chạy được","2","Có demo trước/sau hoặc tình huống minh họa trực quan","1.5"
"Có biện pháp phòng thủ","2","Đề xuất hoặc demo được cách giảm thiểu rủi ro","1.5"
"Evidence đầy đủ","1.5","Có ảnh chụp, log, video ngắnhoặc kết quả kiểm thử","1.2"
"Threat model hợp lý","1","Xác định được asset, threat, vulnerability, impact, mitigation","0.7"
"Tuân thủ đạo đức và an toàn","1","Chỉ demo trong lab/local, không dùng dữ liệu thật, không tấn công hệ thống thật","0.7"
"Trình bày tốt","0.5","Rõ ràng, đúng thời lượng, phân vai hợp lý","0.4"
"Tổng điểm","10","","7.5"
